{"camera":{"end_ms":3000,"preset":"static","start_ms":0},"captions":[{"end_ms":3000,"granularity":"segment","segment_id":"seg-1","speaker_id":"host","start_ms":0,"text":"讲解标题"}],"duration_ms":3000,"elements":[{"cue":{"basis":"segment","precision":"exact","segment_id":"seg-1"},"duration_ms":420,"easing":"power2.out","effect":"fade_up","element_id":"title","start_ms":0}],"fallback":{"reason":null,"strategy":"browser_frames"},"page_id":"page-1","scene_manifest_sha256":"6a7cc23bc0793020aa14783a1d9e1ba25be03b2cf86b2a570b9f673e1b359df1","schema_version":1,"timing_quality":"segment_exact","transition":{"direction":null,"duration_ms":0,"type":"cut"},"warnings":[]}