{"camera":{"end_ms":6000,"preset":"subtle_push","start_ms":0},"captions":[{"end_ms":3000,"granularity":"segment","segment_id":"seg-1","speaker_id":"speaker-a","start_ms":100,"text":"这是讲解文案。"}],"duration_ms":6000,"elements":[{"cue":{"basis":"segment","precision":"exact","segment_id":"seg-1"},"duration_ms":700,"easing":"power3.out","effect":"fade_up","element_id":"title","start_ms":200},{"cue":{"basis":"segment","precision":"exact","segment_id":"seg-1"},"duration_ms":900,"easing":"power2.out","effect":"count_up","element_id":"metric","start_ms":1200}],"fallback":{"reason":null,"strategy":"browser_frames"},"page_id":"../outside","scene_manifest_sha256":"26817f9994924e66eb478f2d9175e001b6d020a5754db8844f459853a8438dd5","schema_version":1,"timing_quality":"segment_exact","transition":{"direction":null,"duration_ms":420,"type":"crossfade"},"warnings":[]}